{
  "$schema": "https://json-schema.org/draft/2020-12/schema",
  "$id": "https://dna.codes/schemas/product/ui",
  "title": "ProductUiDNA",
  "description": "A complete Product UI DNA document for an application instance. Composes a layout with pages and routes into a single UI surface definition.",
  "type": "object",
  "required": ["layout", "pages", "routes"],
  "properties": {
    "layout": {
      "$ref": "https://dna.codes/schemas/product/web/layout",
      "description": "The structural shell all pages in this UI live within."
    },
    "pages": {
      "type": "array",
      "description": "The discrete screens that make up this UI, each mapped from a Resource.",
      "minItems": 1,
      "items": { "$ref": "https://dna.codes/schemas/product/web/page" }
    },
    "routes": {
      "type": "array",
      "description": "The URL patterns that resolve to pages in this UI.",
      "minItems": 1,
      "items": { "$ref": "https://dna.codes/schemas/product/web/route" }
    },
    "apps": {
      "type": "array",
      "description": "Top-level product surfaces, each the product face of a business function (grouping anchor). The container above Module.",
      "items": { "$ref": "https://dna.codes/schemas/product/ui/app" }
    },
    "modules": {
      "type": "array",
      "description": "Feature-area groupings beneath an App and above Workflow/Page — typically the product surface of a sub-Domain or Process.",
      "items": { "$ref": "https://dna.codes/schemas/product/ui/module" }
    },
    "workflows": {
      "type": "array",
      "description": "Navigable groupings of Pages above the Page level — the user journeys this UI supports.",
      "items": { "$ref": "https://dna.codes/schemas/product/ui/workflow" }
    },
    "operations": {
      "type": "array",
      "description": "The behavioral UIOperations of this UI — trigger plus effects describing what happens on user interaction.",
      "items": { "$ref": "https://dna.codes/schemas/product/ui/operation" }
    }
  },
  "examples": [
    {
      "layout": {
        "name": "LendingDashboard",
        "type": "sidebar",
        "description": "Primary shell for the lending application."
      },
      "pages": [
        {
          "name": "LoanList",
          "resource": "Loan",
          "blocks": [
            { "name": "LoanTable", "type": "table", "operation": "Loan.List" }
          ]
        },
        {
          "name": "LoanDetail",
          "resource": "Loan",
          "blocks": [
            { "name": "LoanSummary", "type": "detail", "operation": "Loan.View" },
            { "name": "LoanActions", "type": "actions" }
          ]
        }
      ],
      "routes": [
        { "path": "/loans", "page": "LoanList" },
        { "path": "/loans/:id", "page": "LoanDetail" }
      ]
    }
  ]
}
